{
  "protocolVersion": 1,
  "kind": "request",
  "requestId": "r-1",
  "method": "doc.apply",
  "documentId": "00000000-0000-4000-8000-000000000001",
  "sessionId": "00000000-0000-4000-8000-000000005000",
  "params": {
    "pageId": "00000000-0000-4000-8000-000000000002",
    "transactionId": "00000000-0000-4000-8000-000000900000",
    "baseRevision": 0,
    "atomic": true,
    "operations": [
      { "op": "set", "target": "00000000-0000-4000-8000-000000000100", "patch": { "assetId": "asset:logo-v2" } },
      { "op": "move", "target": "s1", "delta": { "xPt": 8.5039, "yPt": 0 } }
    ]
  }
}
